
--Some restore Command using rman
	Restoring:
	• Database (all data files)
	• Tablespaces
	• Control files
	• Archived redo logs
	• Server parameter files
	
--So Restore backup means last backup will be restored 
--On the other hand, Recovering means last changes from redo log

Note: sys and redo log are critical and others are non critical files.

Using RMAN RESTORE and RECOVER Commands
-----------------------------------------------
	• RESTORE command: Restores database files from backup
	• RECOVER command: Recovers restored files by applying changes recorded in incremental backups and redo log files

	RMAN> ALTER TABLESPACE inv_tbs OFFLINE IMMEDIATE;
	RMAN> RESTORE TABLESPACE inv_tbs;
	RMAN> RECOVER TABLESPACE inv_tbs;
	RMAN> ALTER TABLESPACE inv_tbs ONLINE;
	

--let's select tablespaces

	SQL> select *from v$tablespace;

		   TS# NAME                           INC BIG FLA ENC     CON_ID
	---------- ------------------------------ --- --- --- --- ----------
			 0 SYSTEM                         YES NO  YES              0
			 7 RESUMETAB                      YES NO  YES              0
			 1 SYSAUX                         YES NO  YES              0
			 2 UNDOTBS1                       YES NO  YES              0
			 6 DBA167TAB1                     YES NO  YES              0
			 4 USERS                          YES NO  YES              0
			 8 AUDITTAB                       YES NO  YES              0
			 9 RMANTAB                        YES NO  YES              0
			 3 TEMP                           NO  NO  YES              0
			10 TEST_CORP_TAB                  YES NO  YES              0

	10 rows selected.

--now we will query from this hr.test_corp table

	SQL> select *from hr.test_corp;

			ID NAME
	---------- --------------------------------------------------
			 1 Roha

--before dropting datafile, we will get backup the tablespace test_corp_tab

	RMAN> backup tablespace test_corp_tab;

--now we will check datafile locations from v$datafile

	SQL> select name from v$datafile;

	NAME
	--------------------------------------------------------------------------------
	+DATA/DBA167/DATAFILE/system.257.1107575803
	+DATA/DBA167/DATAFILE/resumetab01.dbf
	+DATA/DBA167/DATAFILE/sysaux.258.1107575839
	+DATA/DBA167/DATAFILE/undotbs1.259.1107575853
	+DATA/DBA167/DATAFILE/dba167tab1
	+DATA/DBA167/DATAFILE/users.260.1107575855
	+DATA/DBA167/DATAFILE/audittab.269.1110732263
	+DATA/DBA167/DATAFILE/rmantab.271.1113838853
	/u01/app/oracle/oradata/test_corp_tab01.dbf

	9 rows selected.

--let's locate the datafile of tablespace test_corp_tab

	[oracle@dba167 ~]$ cd /u01/app/oracle/oradata/
	[oracle@dba167 oradata]$ ll
	total 10248
	-rw-r-----. 1 oracle asmadmin 10493952 Aug 30 13:37 test_corp_tab01.dbf

--let's delete the datafile from above listing..
	[oracle@dba167 oradata]$ rm test_corp_tab01.dbf

--now we will flush buffer cache
	SQL> alter system flush buffer_cache;

--let's select data from test_corp table
	SQL> select * from hr.test_corp;
	select * from hr.test_corp
					 *
	ERROR at line 1:
	ORA-01116: error in opening database file 10
	ORA-01110: data file 10: '/u01/app/oracle/oradata/test_corp_tab01.dbf'
	ORA-27041: unable to open file
	Linux-x86_64 Error: 2: No such file or directory
	Additional information: 3

--Now we wanna shutdown the database using rman and sys user....
	RMAN> shutdown immediate;

	using target database control file instead of recovery catalog
	RMAN-00571: ===========================================================
	RMAN-00569: =============== ERROR MESSAGE STACK FOLLOWS ===============
	RMAN-00571: ===========================================================
	RMAN-03002: failure of shutdown command at 08/30/2022 13:41:46
	ORA-01116: error in opening database file 10
	ORA-01110: data file 10: '/u01/app/oracle/oradata/test_corp_tab01.dbf'
	ORA-27041: unable to open file
	Linux-x86_64 Error: 2: No such file or directory
	Additional information: 3

	
	SQL> shutdown immediate;
	ORA-01116: error in opening database file 10
	ORA-01110: data file 10: '/u01/app/oracle/oradata/test_corp_tab01.dbf'
	ORA-27041: unable to open file
	Linux-x86_64 Error: 2: No such file or directory
	Additional information: 3

--Note: The shutdown operation not working because the database do not open missing datafile file. 
--So we need to abort shutdown option to resolve this issue... 
	SQL> shutdown abort
	ORACLE instance shut down.

--Startup database now...

	SQL> startup
	ORACLE instance started.

	Total System Global Area 4294963272 bytes
	Fixed Size                  8904776 bytes
	Variable Size            2466250752 bytes
	Database Buffers         1811939328 bytes
	Redo Buffers                7868416 bytes
	Database mounted.
	ORA-01157: cannot identify/lock data file 10 - see DBWR trace file
	ORA-01110: data file 10: '/u01/app/oracle/oradata/test_corp_tab01.dbf'

-- The error "ORA-01110: data file 10: " arised.

--Now we gonna to offile the datafile with number 10(this is the datafile no)
	SQL> alter database datafile 10 offline;

	Database altered.

	--Now we will open the database using below command..
	SQL> alter database open;

	Database altered.

--So if we execute the select statement for test_corp and it will give an error....
	SQL> select *from hr.test_corp;
	select *from hr.test_corp
					*
	ERROR at line 1:
	ORA-00376: file 10 cannot be read at this time
	ORA-01110: data file 10: '/u01/app/oracle/oradata/test_corp_tab01.dbf'

--So haw to do we resolve this issue? let's restore the tablespace

	RMAN> restore tablespace test_corp_tab;

	Starting restore at 30-AUG-22
	using target database control file instead of recovery catalog
	allocated channel: ORA_DISK_1
	channel ORA_DISK_1: SID=38 device type=DISK

	channel ORA_DISK_1: starting datafile backup set restore
	channel ORA_DISK_1: specifying datafile(s) to restore from backup set
	channel ORA_DISK_1: restoring datafile 00010 to /u01/app/oracle/oradata/test_corp_tab01.dbf
	channel ORA_DISK_1: reading from backup piece +FRA/DBA167/BACKUPSET/2022_08_30/nnndf0_tag20220830t021552_0.337.1114049753
	channel ORA_DISK_1: piece handle=+FRA/DBA167/BACKUPSET/2022_08_30/nnndf0_tag20220830t021552_0.337.1114049753 tag=TAG20220830T021552
	channel ORA_DISK_1: restored backup piece 1
	channel ORA_DISK_1: restore complete, elapsed time: 00:00:01
	Finished restore at 30-AUG-22

--As we can see that the file restored from rman backkup and let's check it...
	[oracle@dba167 oradata]$ ll
	total 10248
	-rw-r-----. 1 oracle asmadmin 10493952 Aug 30 13:49 test_corp_tab01.dbf

--now we need to recover by using the following rman command

	RMAN> recover tablespace test_corp_tab;

	Starting recover at 30-AUG-22
	using target database control file instead of recovery catalog
	allocated channel: ORA_DISK_1
	channel ORA_DISK_1: SID=24 device type=DISK

	starting media recovery
	media recovery complete, elapsed time: 00:00:00

	Finished recover at 30-AUG-22

--And Now we have to online the tablespace "test_corp_tab"
	RMAN>  sql 'alter tablespace test_corp_tab online';

	sql statement: alter tablespace test_corp_tab online

--Let's execute the following operation...

	SQL>  select * from hr.test_corp;

			ID NAME
	---------- --------------------------------------------------
			 1 Roha


############################################################

	SQL> show parameter undo

	NAME                                 TYPE        VALUE
	------------------------------------ ----------- ------------------------------
	temp_undo_enabled                    boolean     FALSE
	undo_management                      string      AUTO
	undo_retention                       integer     3600
	undo_tablespace                      string      UNDOTBS1



	SQL> select file_name,tablespace_name from dba_data_files;

	file_name										tablespace_name
	---------------------------------------------------------------------
	+DATA/DBA167/DATAFILE/system.257.1107575803		SYSTEM
	+DATA/DBA167/DATAFILE/sysaux.258.1107575839		SYSAUX
	+DATA/DBA167/DATAFILE/undotbs1.259.1107575853	UNDOTBS1
	+DATA/DBA167/DATAFILE/users.260.1107575855		USERS
	+DATA/DBA167/DATAFILE/dba167tab1				DBA167TAB1
	+DATA/DBA167/DATAFILE/resumetab01.dbf			RESUMETAB
	+DATA/DBA167/DATAFILE/audittab.269.1110732263	AUDITTAB
	+DATA/DBA167/DATAFILE/rmantab.271.1113838853	RMANTAB
	/u01/app/oracle/oradata/test_corp_tab01.dbf		TEST_CORP_TAB


--let's create a undo tablespace

	SQL> create undo tablespace UNDOTAB2 datafile '/u01/app/oracle/oradata/undotab201.dbf' size 10M autoextend on;

	Tablespace created.

--Show parameter's of undo
SQL> show parameter undo

NAME                                 TYPE        VALUE
------------------------------------ ----------- ------------------------------
temp_undo_enabled                    boolean     FALSE
undo_management                      string      AUTO
undo_retention                       integer     3600
undo_tablespace                      string      UNDOTBS1

--Let's alter undo tablespace
SQL> alter system set undo_tablespace='UNDOTAB2';

System altered.

--now check the tablespace info 
SQL> show parameter undo;

NAME                                 TYPE        VALUE
------------------------------------ ----------- ------------------------------
temp_undo_enabled                    boolean     FALSE
undo_management                      string      AUTO
undo_retention                       integer     3600
undo_tablespace                      string      UNDOTAB2
SQL>

SQL> create table employees_bak as select *From employees;

Table created.

SQL> select *From employees_bak

SQL> update hr.employees_bak set salary=salary+100;


RMAN> delete backup;

RMAN> backup database;

SQL> update hr.employees_bak set salary=salary+100;


SQL> commit;

Commit complete.

tail -200f /u01/app/oracle/diag/rdbms/dba167/dba167/trace/alert_dba167.log


[oracle@dba167 oradata]$ rm undotab201.dbf

SQL> alter system flush buffer_cache;

SQL> update hr.employees_bak set salary=salary+100;
update hr.employees_bak set salary=salary+100
          *
ERROR at line 1:
ORA-01116: error in opening database file 12
ORA-01110: data file 12: '/u01/app/oracle/oradata/undotab201.dbf'
ORA-27041: unable to open file
Linux-x86_64 Error: 2: No such file or directory
Additional information: 3


SQL> conn hr/hr
ERROR:
ORA-01116: error in opening database file 12
ORA-01110: data file 12: '/u01/app/oracle/oradata/undotab201.dbf'
ORA-27041: unable to open file
Linux-x86_64 Error: 2: No such file or directory
Additional information: 3


Warning: You are no longer connected to ORACLE.


SQL> conn / as sysdba
Connected.
SQL> shutdown abort
ORACLE instance shut down.


SQL> startup
ORACLE instance started.

Total System Global Area 2466249672 bytes
Fixed Size                  8899528 bytes
Variable Size             536870912 bytes
Database Buffers         1912602624 bytes
Redo Buffers                7876608 bytes
Database mounted.
ORA-01157: cannot identify/lock data file 12 - see DBWR trace file
ORA-01110: data file 12: '/u01/app/oracle/oradata/undotab201.dbf'

-- as we can see above messsage and also can view alert logs....

SQL> alter database datafile 12 offline;

Database altered.


SQL> alter database open;


Database altered.


SQL> update hr.employees_bak set salary=salary+100;
update hr.employees_bak set salary=salary+100
          *
ERROR at line 1:
ORA-01552: cannot use system rollback segment for non-system tablespace 'USERS'



RMAN> restore tablespace undotab2;


RMAN> recover tablespace undotab2;


SQL> alter database datafile 12 online;

Database altered.


SQL> update hr.employees_bak set salary=salary+100;
SQL> select *From employees_bak


10-9

--relocating datafile using RMAN

RMAN> delete backup

RMAN> backup database;

SQL> SELECT NAME FROM V$DATAFILE;

NAME
--------------------------------------------------------------------------------
+DATA/DBA167/DATAFILE/system.257.1106721763
+DATA/DBA167/DATAFILE/testtab101
+DATA/DBA167/DATAFILE/sysaux.258.1106721809
+DATA/DBA167/DATAFILE/undotbs1.259.1106721833
+DATA/DBA167/DATAFILE/dba167tab1
+DATA/DBA167/DATAFILE/users.260.1106721835
+DATA/DBA167/DATAFILE/testtab2.268.1109876153
+FRA/DBA167/DATAFILE/testtab401.dbf
+FRA/DBA167/Backup_DATAFILE/testundo.dbf
/u01/app/oracle/oradata/test_corp_tab01.dbf
/u01/app/oracle/oradata/undotab201.dbf

11 rows selected.


SQL> shutdown immediate;

SQL> startup mount;

RMAN> 
run 
{
	SET NEWNAME FOR DATAFILE '+DATA/DBA167/DATAFILE/users.260.1106721835' TO '/u01/app/oracle/oradata/users01.dbf';
	RESTORE DATAFILE 7;
	SWITCH DATAFILE ALL;
	RECOVER DATAFILE 7;
}

SQL> alter database open;


SQL> select name from v$datafile;

NAME
--------------------------------------------------------------------------------
+DATA/DBA167/DATAFILE/system.257.1106721763
+DATA/DBA167/DATAFILE/testtab101
+DATA/DBA167/DATAFILE/sysaux.258.1106721809
+DATA/DBA167/DATAFILE/undotbs1.259.1106721833
+DATA/DBA167/DATAFILE/dba167tab1
/u01/app/oracle/oradata/users01.dbf
+DATA/DBA167/DATAFILE/testtab2.268.1109876153
+FRA/DBA167/DATAFILE/testtab401.dbf
+FRA/DBA167/Backup_DATAFILE/testundo.dbf
/u01/app/oracle/oradata/test_corp_tab01.dbf
/u01/app/oracle/oradata/undotab201.dbf

11 rows selected.


Notice that... new location of user data file is "/u01/app/oracle/oradata/users01.dbf"